[
  {
    "id": "ord.kawa",
    "npc": "pan_marek",
    "frame": { "pl": "Słucham?", "ru": "Слушаю?" },
    "need": { "count": 2, "pos": ["adj", "noun"] },
    "build": "phrase",
    "phrase": { "tiles": ["Mała", "kawa", "proszę", "Mały"], "answer": ["Mała", "kawa", "proszę"] },
    "delivery": { "location": "demo.kawiarnia", "at": [2, 2] },
    "if": { "mastery": { "module": "demo", "level": "seen", "min": 0.5 } }
  }
]
